{"schema_version":"local-monitor-comparison-create.response.v1","comparison_id":"018f0000-0000-7000-8000-000000000010","location":"/repositories/018f0000-0000-7000-8000-000000000100/comparisons/018f0000-0000-7000-8000-000000000010","receipt_sha256":"5555555555555555555555555555555555555555555555555555555555555555","created_at":"2026-08-29T00:00:00.0000000+00:00","expires_at":"2026-08-30T00:00:00.0000000+00:00"}